{
  "$schema": "https://opencode.ai/desktop-theme.json",
  "name": "Codex",
  "id": "codex",
  "light": {
    "palette": {
      "neutral": "#f7f7f7",
      "ink": "#171717",
      "primary": "#2f92df",
      "accent": "#2f92df",
      "success": "#168447",
      "warning": "#c65d19",
      "error": "#d43d37",
      "info": "#247cc0",
      "interactive": "#147cc1",
      "diffAdd": "#168447",
      "diffDelete": "#d43d37"
    },
    "overrides": {
      "background-base": "#ffffff",
      "background-stronger": "#ffffff",
      "surface-base": "#ffffff",
      "surface-base-hover": "#0000000a",
      "surface-raised-base": "#ffffff",
      "surface-raised-base-hover": "#f2f2f2",
      "surface-inset-base": "#eeeeee",
      "shell-surface-sidebar": "#f9f9f9",
      "shell-surface-header": "#ffffff",
      "shell-surface-composer": "#ffffff",
      "shell-surface-context-card": "#f7f7f7",
      "control-surface": "#ededed",
      "control-surface-active": "#ffffff",
      "overlay-surface": "#ffffff",
      "surface-raised-stronger-non-alpha": "#ffffff",
      "overlay-surface-hover": "#f3f3f3",
      "overlay-surface-input": "#00000014",
      "settings-surface-content": "#f7f7f7",
      "settings-surface-card": "#ffffff",
      "tab-surface-selected": "#ededed",
      "row-surface-hover": "#0000000a",
      "row-surface-selected": "#1a1c1f0d",
      "shell-border-sidebar": "#ededed",
      "shell-border-header": "#ededed",
      "composer-border": "#d8d8d8",
      "control-border": "#d8d8d8",
      "overlay-border": "#e0e0e0",
      "overlay-text": "#171717",
      "overlay-text-muted": "#6f6f6f",
      "overlay-icon": "#555555",
      "overlay-icon-muted": "#8c8c8c",
      "border-weak-base": "#d8d8d8",
      "border-weaker-base": "#e6e6e6",
      "text-strong": "#1a1c1f",
      "text-base": "#696a6c",
      "text-weak": "#696a6c",
      "text-weaker": "#8c8d8f",
      "icon-strong-base": "#333333",
      "icon-base": "#6f6f6f",
      "icon-weak-base": "#999999",
      "syntax-comment": "#777777",
      "syntax-keyword": "#9d3e82",
      "syntax-string": "#347c43",
      "syntax-primitive": "#b04d25",
      "syntax-variable": "#171717",
      "syntax-property": "#976622",
      "syntax-type": "#5d52a8",
      "syntax-constant": "#147c83",
      "syntax-operator": "#4f4f4f",
      "syntax-punctuation": "#777777",
      "syntax-object": "#171717",
      "markdown-heading": "#171717",
      "markdown-text": "#4f4f4f",
      "markdown-link": "#147cc1",
      "markdown-link-text": "#4f4f4f",
      "markdown-code": "#347c43",
      "markdown-block-quote": "#777777",
      "markdown-emph": "#171717",
      "markdown-strong": "#171717",
      "markdown-horizontal-rule": "#d8d8d8",
      "markdown-list-item": "#4f4f4f",
      "markdown-list-enumeration": "#777777",
      "markdown-image": "#147cc1",
      "markdown-image-text": "#777777",
      "markdown-code-block": "#171717"
    },
    "v2Overrides": {
      "v2-background-bg-base": "#ffffff",
      "v2-background-bg-deep": "#f7f7f7",
      "v2-background-bg-layer-01": "#f3f3f3",
      "v2-background-bg-layer-02": "#ededed",
      "v2-background-bg-layer-03": "#e3e3e3",
      "v2-background-bg-layer-04": "#d8d8d8",
      "v2-background-bg-inverse": "#171717",
      "v2-background-bg-contrast": "#282828",
      "v2-background-bg-button-neutral": "#ffffff",
      "v2-background-bg-accent": "#2f92df",
      "v2-text-text-base": "#171717",
      "v2-text-text-muted": "#6f6f6f",
      "v2-text-text-faint": "#8c8c8c",
      "v2-text-text-inverse": "#f7f7f7",
      "v2-text-text-contrast": "#ffffff",
      "v2-text-text-accent": "#147cc1",
      "v2-text-text-accent-hover": "#0f6cab",
      "v2-text-text-code-accent": "#176ca4",
      "v2-icon-icon-base": "#555555",
      "v2-icon-icon-muted": "#8c8c8c",
      "v2-icon-icon-inverse": "#f7f7f7",
      "v2-icon-icon-contrast": "#ffffff",
      "v2-icon-icon-accent": "#147cc1",
      "v2-icon-icon-accent-hover": "#0f6cab",
      "v2-border-border-muted": "#00000012",
      "v2-border-border-base": "#0000001f",
      "v2-border-border-strong": "#00000033",
      "v2-border-border-inverse": "#282828",
      "v2-border-border-focus": "#2f92df",
      "v2-overlay-simple-overlay-hover": "#0000000a",
      "v2-overlay-simple-overlay-pressed": "#00000012",
      "v2-overlay-simple-overlay-scrim": "#00000066"
    }
  },
  "dark": {
    "palette": {
      "neutral": "#171717",
      "ink": "#f2f2f2",
      "primary": "#369ce8",
      "accent": "#369ce8",
      "success": "#35bd70",
      "warning": "#f28b45",
      "error": "#ef5350",
      "info": "#58a6e7",
      "interactive": "#58a6e7",
      "diffAdd": "#35bd70",
      "diffDelete": "#ef5350"
    },
    "overrides": {
      "background-base": "#0d0d0d",
      "background-stronger": "#0d0d0d",
      "surface-base": "#181818",
      "surface-base-hover": "#282828",
      "surface-raised-base": "#212121",
      "surface-raised-base-hover": "#282828",
      "surface-inset-base": "#1c1c1c",
      "shell-surface-sidebar": "#181818",
      "shell-surface-header": "#0d0d0d",
      "shell-surface-composer": "#212121",
      "shell-surface-context-card": "#1c1c1c",
      "control-surface": "#1c1c1c",
      "control-surface-active": "#303030",
      "overlay-surface": "#212121",
      "surface-raised-stronger-non-alpha": "#212121",
      "overlay-surface-hover": "#303030",
      "overlay-surface-input": "#ffffff0f",
      "settings-surface-content": "#0d0d0d",
      "settings-surface-card": "#1c1c1c",
      "tab-surface-selected": "#1c1c1c",
      "row-surface-hover": "#282828",
      "row-surface-selected": "#303030",
      "shell-border-sidebar": "#303030",
      "shell-border-header": "#303030",
      "composer-border": "#303030",
      "control-border": "#414141",
      "overlay-border": "#414141",
      "overlay-text": "#f2f2f2",
      "overlay-text-muted": "#bdbdbd",
      "overlay-icon": "#dedede",
      "overlay-icon-muted": "#a3a3a3",
      "border-base": "#303030",
      "border-weak-base": "#282828",
      "border-weaker-base": "#212121",
      "text-strong": "#f2f2f2",
      "text-base": "#d6d6d6",
      "text-weak": "#a3a3a3",
      "text-weaker": "#747474",
      "icon-strong-base": "#e0e0e0",
      "icon-base": "#bdbdbd",
      "icon-weak-base": "#8a8a8a",
      "surface-success-base": "#183d29",
      "surface-critical-base": "#452321",
      "text-diff-add-base": "#65ce86",
      "text-diff-delete-base": "#ff716b",
      "syntax-comment": "#777777",
      "syntax-keyword": "#c586c0",
      "syntax-string": "#7ec699",
      "syntax-primitive": "#e99569",
      "syntax-variable": "#d4d4d4",
      "syntax-property": "#d7ba7d",
      "syntax-type": "#b5a8e5",
      "syntax-constant": "#69c8cf",
      "syntax-operator": "#d4d4d4",
      "syntax-punctuation": "#999999",
      "syntax-object": "#d4d4d4",
      "syntax-critical": "#ff716b",
      "syntax-diff-add": "#65ce86",
      "syntax-diff-delete": "#ff716b",
      "markdown-heading": "#f2f2f2",
      "markdown-text": "#d0d0d0",
      "markdown-link": "#58a6e7",
      "markdown-link-text": "#d0d0d0",
      "markdown-code": "#7ec699",
      "markdown-block-quote": "#999999",
      "markdown-emph": "#f2f2f2",
      "markdown-strong": "#f2f2f2",
      "markdown-horizontal-rule": "#303030",
      "markdown-list-item": "#d0d0d0",
      "markdown-list-enumeration": "#999999",
      "markdown-image": "#58a6e7",
      "markdown-image-text": "#999999",
      "markdown-code-block": "#d0d0d0"
    },
    "v2Overrides": {
      "v2-background-bg-base": "#2d2d2d",
      "v2-background-bg-deep": "#171717",
      "v2-background-bg-layer-01": "#222222",
      "v2-background-bg-layer-02": "#2b2b2b",
      "v2-background-bg-layer-03": "#343434",
      "v2-background-bg-layer-04": "#414141",
      "v2-background-bg-inverse": "#f2f2f2",
      "v2-background-bg-contrast": "#3b3b3b",
      "v2-background-bg-button-neutral": "#ffffff0f",
      "v2-background-bg-accent": "#369ce8",
      "v2-text-text-base": "#f2f2f2",
      "v2-text-text-muted": "#a3a3a3",
      "v2-text-text-faint": "#888888",
      "v2-text-text-inverse": "#171717",
      "v2-text-text-contrast": "#ffffff",
      "v2-text-text-accent": "#68b5ed",
      "v2-text-text-accent-hover": "#86c5f1",
      "v2-text-text-code-accent": "#68b5ed",
      "v2-icon-icon-base": "#c5c5c5",
      "v2-icon-icon-muted": "#888888",
      "v2-icon-icon-inverse": "#171717",
      "v2-icon-icon-contrast": "#f2f2f2",
      "v2-icon-icon-accent": "#68b5ed",
      "v2-icon-icon-accent-hover": "#86c5f1",
      "v2-border-border-muted": "#ffffff12",
      "v2-border-border-base": "#ffffff1f",
      "v2-border-border-strong": "#ffffff33",
      "v2-border-border-inverse": "#f2f2f2",
      "v2-border-border-focus": "#58a6e7",
      "v2-overlay-simple-overlay-hover": "#ffffff0a",
      "v2-overlay-simple-overlay-pressed": "#ffffff12",
      "v2-overlay-simple-overlay-scrim": "#00000099",
      "v2-overlay-simple-tab-active-scrim": "#2d2d2d00",
      "v2-overlay-simple-tab-hover-scrim": "#3a3a3a00",
      "v2-overlay-simple-tab-scrim": "#17171700"
    }
  }
}
